{"benchmark_id":"holdem-v1-cuda-baseline-1","cells":[{"opponent_count":"1","requested_trials":"10000","run_class":"steady","scenario_id":"v1-preflop-o1-n10000","stages":{"d2h_ns":"1568","h2d_ns":"22976","reduction_ns":"17728","simulate_ns":"144896"},"steady":{"p50_ns":"1987908","p50_throughput_per_second":"5030413.882","p5_ns":"1830728","p95_ns":"2289370"},"street":"preflop"},{"opponent_count":"1","requested_trials":"100000","run_class":"steady","scenario_id":"v1-preflop-o1-n100000","stages":{"d2h_ns":"25952","h2d_ns":"68000","reduction_ns":"84704","simulate_ns":"954240"},"steady":{"p50_ns":"3057423","p50_throughput_per_second":"32707283.225","p5_ns":"2915082","p95_ns":"3491805"},"street":"preflop"},{"opponent_count":"1","requested_trials":"500000","run_class":"steady","scenario_id":"v1-preflop-o1-n500000","stages":{"d2h_ns":"69504","h2d_ns":"17664","reduction_ns":"353696","simulate_ns":"4324064"},"steady":{"p50_ns":"7640653","p50_throughput_per_second":"65439432.991","p5_ns":"7349561","p95_ns":"8148825"},"street":"preflop"},{"opponent_count":"1","requested_trials":"1000000","run_class":"steady","scenario_id":"v1-preflop-o1-n1000000","stages":{"d2h_ns":"118432","h2d_ns":"17632","reduction_ns":"698528","simulate_ns":"8779264"},"steady":{"p50_ns":"13308677","p50_throughput_per_second":"75138948.823","p5_ns":"13099087","p95_ns":"13617039"},"street":"preflop"},{"opponent_count":"3","requested_trials":"10000","run_class":"steady","scenario_id":"v1-preflop-o3-n10000","stages":{"d2h_ns":"2656","h2d_ns":"17408","reduction_ns":"17536","simulate_ns":"267040"},"steady":{"p50_ns":"2008799","p50_throughput_per_second":"4978098.854","p5_ns":"1910088","p95_ns":"2408790"},"street":"preflop"},{"opponent_count":"3","requested_trials":"100000","run_class":"steady","scenario_id":"v1-preflop-o3-n100000","stages":{"d2h_ns":"23872","h2d_ns":"16832","reduction_ns":"84128","simulate_ns":"1869728"},"steady":{"p50_ns":"4016318","p50_throughput_per_second":"24898426.868","p5_ns":"3845427","p95_ns":"4514669"},"street":"preflop"},{"opponent_count":"3","requested_trials":"500000","run_class":"steady","scenario_id":"v1-preflop-o3-n500000","stages":{"d2h_ns":"46752","h2d_ns":"17056","reduction_ns":"352352","simulate_ns":"8628800"},"steady":{"p50_ns":"12024152","p50_throughput_per_second":"41582974.001","p5_ns":"11852661","p95_ns":"12285064"},"street":"preflop"},{"opponent_count":"3","requested_trials":"1000000","run_class":"steady","scenario_id":"v1-preflop-o3-n1000000","stages":{"d2h_ns":"105280","h2d_ns":"17184","reduction_ns":"696384","simulate_ns":"17114560"},"steady":{"p50_ns":"22284466","p50_throughput_per_second":"44874308.408","p5_ns":"21960345","p95_ns":"22753879"},"street":"preflop"},{"opponent_count":"6","requested_trials":"10000","run_class":"steady","scenario_id":"v1-preflop-o6-n10000","stages":{"d2h_ns":"2560","h2d_ns":"69216","reduction_ns":"18112","simulate_ns":"398240"},"steady":{"p50_ns":"2271590","p50_throughput_per_second":"4402202.862","p5_ns":"2080829","p95_ns":"2698552"},"street":"preflop"},{"opponent_count":"6","requested_trials":"100000","run_class":"steady","scenario_id":"v1-preflop-o6-n100000","stages":{"d2h_ns":"19520","h2d_ns":"17664","reduction_ns":"87008","simulate_ns":"3192192"},"steady":{"p50_ns":"5468124","p50_throughput_per_second":"18287807.665","p5_ns":"5260593","p95_ns":"5758075"},"street":"preflop"},{"opponent_count":"6","requested_trials":"500000","run_class":"steady","scenario_id":"v1-preflop-o6-n500000","stages":{"d2h_ns":"75008","h2d_ns":"17888","reduction_ns":"351616","simulate_ns":"14969984"},"steady":{"p50_ns":"18688501","p50_throughput_per_second":"26754419.737","p5_ns":"18497580","p95_ns":"18914252"},"street":"preflop"},{"opponent_count":"6","requested_trials":"1000000","run_class":"steady","scenario_id":"v1-preflop-o6-n1000000","stages":{"d2h_ns":"128096","h2d_ns":"16960","reduction_ns":"692000","simulate_ns":"30074816"},"steady":{"p50_ns":"35450424","p50_throughput_per_second":"28208407.324","p5_ns":"35258673","p95_ns":"35716185"},"street":"preflop"},{"opponent_count":"1","requested_trials":"10000","run_class":"steady","scenario_id":"v1-flop-o1-n10000","stages":{"d2h_ns":"4512","h2d_ns":"16448","reduction_ns":"17728","simulate_ns":"119680"},"steady":{"p50_ns":"1953329","p50_throughput_per_second":"5119465.282","p5_ns":"1803107","p95_ns":"2238530"},"street":"flop"},{"opponent_count":"1","requested_trials":"100000","run_class":"steady","scenario_id":"v1-flop-o1-n100000","stages":{"d2h_ns":"5632","h2d_ns":"16960","reduction_ns":"85856","simulate_ns":"823840"},"steady":{"p50_ns":"2888563","p50_throughput_per_second":"34619289.938","p5_ns":"2733552","p95_ns":"3274264"},"street":"flop"},{"opponent_count":"1","requested_trials":"500000","run_class":"steady","scenario_id":"v1-flop-o1-n500000","stages":{"d2h_ns":"51648","h2d_ns":"17024","reduction_ns":"351968","simulate_ns":"3643552"},"steady":{"p50_ns":"6840359","p50_throughput_per_second":"73095578.755","p5_ns":"6448068","p95_ns":"7180531"},"street":"flop"},{"opponent_count":"1","requested_trials":"1000000","run_class":"steady","scenario_id":"v1-flop-o1-n1000000","stages":{"d2h_ns":"146880","h2d_ns":"99872","reduction_ns":"696576","simulate_ns":"7065024"},"steady":{"p50_ns":"11680871","p50_throughput_per_second":"85610054.250","p5_ns":"11486670","p95_ns":"12050602"},"street":"flop"},{"opponent_count":"3","requested_trials":"10000","run_class":"steady","scenario_id":"v1-flop-o3-n10000","stages":{"d2h_ns":"8448","h2d_ns":"17216","reduction_ns":"17728","simulate_ns":"188960"},"steady":{"p50_ns":"2071219","p50_throughput_per_second":"4828074.675","p5_ns":"1907478","p95_ns":"2641142"},"street":"flop"},{"opponent_count":"3","requested_trials":"100000","run_class":"steady","scenario_id":"v1-flop-o3-n100000","stages":{"d2h_ns":"9376","h2d_ns":"17248","reduction_ns":"84064","simulate_ns":"1559488"},"steady":{"p50_ns":"3753376","p50_throughput_per_second":"26642681.149","p5_ns":"3561096","p95_ns":"4146638"},"street":"flop"},{"opponent_count":"3","requested_trials":"500000","run_class":"steady","scenario_id":"v1-flop-o3-n500000","stages":{"d2h_ns":"62752","h2d_ns":"63936","reduction_ns":"354400","simulate_ns":"6903712"},"steady":{"p50_ns":"10601546","p50_throughput_per_second":"47162932.652","p5_ns":"10294154","p95_ns":"10897747"},"street":"flop"},{"opponent_count":"3","requested_trials":"1000000","run_class":"steady","scenario_id":"v1-flop-o3-n1000000","stages":{"d2h_ns":"110016","h2d_ns":"16928","reduction_ns":"696288","simulate_ns":"14101408"},"steady":{"p50_ns":"19133463","p50_throughput_per_second":"52264454.166","p5_ns":"18894621","p95_ns":"19618365"},"street":"flop"},{"opponent_count":"6","requested_trials":"10000","run_class":"steady","scenario_id":"v1-flop-o6-n10000","stages":{"d2h_ns":"7712","h2d_ns":"64416","reduction_ns":"18080","simulate_ns":"320416"},"steady":{"p50_ns":"2159319","p50_throughput_per_second":"4631089.709","p5_ns":"1994238","p95_ns":"2440521"},"street":"flop"},{"opponent_count":"6","requested_trials":"100000","run_class":"steady","scenario_id":"v1-flop-o6-n100000","stages":{"d2h_ns":"17344","h2d_ns":"17280","reduction_ns":"87040","simulate_ns":"2712864"},"steady":{"p50_ns":"4993442","p50_throughput_per_second":"20026266.451","p5_ns":"4760590","p95_ns":"5390984"},"street":"flop"},{"opponent_count":"6","requested_trials":"500000","run_class":"steady","scenario_id":"v1-flop-o6-n500000","stages":{"d2h_ns":"64768","h2d_ns":"17696","reduction_ns":"353632","simulate_ns":"12324832"},"steady":{"p50_ns":"16037649","p50_throughput_per_second":"31176639.419","p5_ns":"15870759","p95_ns":"16469992"},"street":"flop"},{"opponent_count":"6","requested_trials":"1000000","run_class":"steady","scenario_id":"v1-flop-o6-n1000000","stages":{"d2h_ns":"135232","h2d_ns":"18176","reduction_ns":"693664","simulate_ns":"24600384"},"steady":{"p50_ns":"30088680","p50_throughput_per_second":"33235090.406","p5_ns":"29899770","p95_ns":"30471172"},"street":"flop"},{"opponent_count":"1","requested_trials":"10000","run_class":"steady","scenario_id":"v1-turn-o1-n10000","stages":{"d2h_ns":"4480","h2d_ns":"17088","reduction_ns":"17760","simulate_ns":"119104"},"steady":{"p50_ns":"1920619","p50_throughput_per_second":"5206654.730","p5_ns":"1800478","p95_ns":"2395121"},"street":"turn"},{"opponent_count":"1","requested_trials":"100000","run_class":"steady","scenario_id":"v1-turn-o1-n100000","stages":{"d2h_ns":"23776","h2d_ns":"16416","reduction_ns":"84256","simulate_ns":"752736"},"steady":{"p50_ns":"2833862","p50_throughput_per_second":"35287533.408","p5_ns":"2672501","p95_ns":"3295625"},"street":"turn"},{"opponent_count":"1","requested_trials":"500000","run_class":"steady","scenario_id":"v1-turn-o1-n500000","stages":{"d2h_ns":"78816","h2d_ns":"17024","reduction_ns":"353984","simulate_ns":"3432160"},"steady":{"p50_ns":"6372028","p50_throughput_per_second":"78467954.001","p5_ns":"6092396","p95_ns":"6800429"},"street":"turn"},{"opponent_count":"1","requested_trials":"1000000","run_class":"steady","scenario_id":"v1-turn-o1-n1000000","stages":{"d2h_ns":"124512","h2d_ns":"17216","reduction_ns":"693984","simulate_ns":"6351520"},"steady":{"p50_ns":"10885647","p50_throughput_per_second":"91864084.882","p5_ns":"10548096","p95_ns":"11500519"},"street":"turn"},{"opponent_count":"3","requested_trials":"10000","run_class":"steady","scenario_id":"v1-turn-o3-n10000","stages":{"d2h_ns":"3520","h2d_ns":"17440","reduction_ns":"21056","simulate_ns":"191488"},"steady":{"p50_ns":"1967798","p50_throughput_per_second":"5081822.423","p5_ns":"1874748","p95_ns":"2506441"},"street":"turn"},{"opponent_count":"3","requested_trials":"100000","run_class":"steady","scenario_id":"v1-turn-o3-n100000","stages":{"d2h_ns":"21504","h2d_ns":"70816","reduction_ns":"86656","simulate_ns":"1390336"},"steady":{"p50_ns":"3588536","p50_throughput_per_second":"27866517.154","p5_ns":"3408445","p95_ns":"3930377"},"street":"turn"},{"opponent_count":"3","requested_trials":"500000","run_class":"steady","scenario_id":"v1-turn-o3